{
  "$schema": "https://json-schema.org/draft/2020-12/schema",
  "$id": "https://schemas.syntara.io/v1alpha1/trigger.schema.json",
  "type": "object",
  "additionalProperties": false,
  "required": ["apiVersion", "kind", "metadata", "spec"],
  "properties": {
    "apiVersion": {"const": "syntara.io/v1alpha1"},
    "kind": {"const": "Trigger"},
    "metadata": {"$ref": "step.schema.json#/$defs/stepMetadata"},
    "spec": {
      "type": "object",
      "additionalProperties": false,
      "required": ["driver", "runtime", "configuration", "input", "output"],
      "properties": {
        "driver": {"$ref": "step.schema.json#/$defs/driver"},
        "runtime": {"$ref": "step.schema.json#/$defs/runner"},
        "configuration": {"$ref": "common.schema.json#/$defs/documentSource"},
        "input": {"$ref": "common.schema.json#/$defs/documentSource"},
        "output": {"$ref": "common.schema.json#/$defs/documentSource", "description": "Schema for StandardOutputWrapper.result on success; describes the business result, not the wrapper."},
        "error": {"$ref": "common.schema.json#/$defs/documentSource", "description": "Optional declared business-error schema; runtime wrapper metadata remains SDK-defined."}
      }
    }
  }
}
