{
  "apiVersion": "syntara.io/v1alpha1",
  "kind": "Trigger",
  "metadata": {
    "name": "publish-artifact-requested",
    "displayName": "Publish artifact requested",
    "description": "Starts the publish-artifact workflow when a parent workflow invokes it."
  },
  "spec": {
    "driver": "subworkflow.v1",
    "runtime": {
      "kind": "platform-runner",
      "driver": "subworkflow.v1"
    },
    "configuration": {
      "kind": "inline",
      "value": {
        "type": "object",
        "description": "A subworkflow trigger has no external transport configuration to declare.",
        "additionalProperties": false
      }
    },
    "input": {
      "kind": "inline",
      "value": {
        "type": "object",
        "description": "Parameters supplied by the invoking parent workflow. Mirrors the parent Control's spec.input.",
        "additionalProperties": false,
        "properties": {
          "artifact": {
            "type": "string",
            "description": "Artifact name to publish."
          },
          "channel": {
            "type": "string",
            "description": "Release channel to publish into."
          }
        },
        "required": ["artifact", "channel"]
      }
    },
    "output": {
      "kind": "inline",
      "value": {
        "type": "object",
        "description": "Event payload handed to the child workflow's first step.",
        "additionalProperties": false,
        "properties": {
          "artifact": {
            "type": "string",
            "description": "Artifact name to publish."
          },
          "channel": {
            "type": "string",
            "description": "Release channel to publish into."
          },
          "parentRunId": {
            "type": "string",
            "description": "Run identifier of the invoking parent workflow."
          }
        },
        "required": ["artifact", "channel", "parentRunId"]
      }
    }
  }
}
